<?xml version="1.0" encoding="utf-8" ?>
<Datatable xmlns:xsi="http://www.w3.org/2001/XMLSchema-instance" xmlns:xsd="http://www.w3.org/2001/XMLSchema" xsi:noNamespaceSchemaLocation="../Schemas/ResourceDefinition.xsd">

    <ResourceDefinition Name="EmpireManpower" Type="LateCollect">
        <ResourceLocation Name="EmpireManpower" LocationPath="ClassEmpire">
            <NetPropertyName>TrueNetEmpireManpower</NetPropertyName>
        </ResourceLocation>
    </ResourceDefinition>

	<!-- Resource just to track Enrollment from Manpower -->
    <ResourceDefinition Name="EnrollmentApplied" Type="Common">
        <ResourceLocation Name="EnrollmentApplied" LocationPath="ClassEmpire,EmpireTypeMajor">
            <MaximumStockPropertyName>MaximumEnrollmentApplied</MaximumStockPropertyName>
            <NetPropertyName>NetEnrollmentApplied</NetPropertyName>
            <StockPropertyName>EnrollmentAppliedToFood</StockPropertyName>
        </ResourceLocation>
    </ResourceDefinition>

    <!-- System resources -->
    <ResourceDefinition Name="WarningProgression" Type="Common">
        <ResourceLocation Name="WarningProgression" LocationPath="ClassEmpire/ClassDiplomacy/ClassDiplomaticEmpire">
            <AccumulatorPropertyName>WarningProgressionAccumulator</AccumulatorPropertyName>
            <StockPropertyName>WarningProgressionStock</StockPropertyName>
        </ResourceLocation>
    </ResourceDefinition>
</Datatable>